name, value
absorption_bleeding, This skill mod decreases the damage taken from bleeding.
absorption_disease, This skill mod reduces the damage taken from disease.
absorption_fire, This skill mod reduces the damage taken from fire.
absorption_poison, This skill mod reduces the the damage taken from poison.
advanced_assembly, This skill mod affects the crafting of advanced starship systems.
advanced_ship_experimentation, This skill mod affects experimentation of advanced ship components.
advertising, This is being removed for now.
aim, This mod increases the efficacy of your aim command.
alert, The Alert skill offers a chance to defend against a surprise shot from a covered sniper.  The higher the skill, the better the chance to successfully defend against this type of attack.
anti_shock, This skill mod determines your resistance to shock.
armor_assembly, This skill mod determines the chance of succeeding when crafting armor.
armor_customization, This skill mod determines the extent of modification you can perform on armor items in the crafting process.
armor_experimentation, This skill mod directly affects how many experimentation points you receive when creating armor.
armor_repair, This skill mod determines how effective you are at repairing armor.
berserk, This mod improves your chance of succesfully entering the berserk state.
bio_engineer_assembly, This skill mod governs the Bio-Engineer's ability to craft creatures and tissue samples.
bio_engineer_experimentation, This skill mod governs the Bio-Engineer's ability to experiment on crafted creatures and tissue samples.
blind_defense, This mod will protect you from being blinded.
block, This mod increases the chance of succesfully blocking an attack. 
body, This skill mod determines how adept the Image Designer is at modifying a character's body.  This is used to change height, weight, muscle, and other customizations.
booster_assembly, This skill mod affects the crafting of boosters for starfighters.
booster_experimentation, This skill mod affects experimentation of ship boosters.
bounty_mission_level, Every point in this mod will allow access to more lucrative and difficult Bounty Hunter missions.
burst_run, The burst run efficiency skill mod is a direct percentage decrease to the cost of using the /burstrun command.
camouflage, A higher camouflage skill means the Ranger's conceal ability will last longer and be more effective on himself and others.
camp, A higher camping skill enables the use of increasingly complex camp kits.
carbine_accuracy, As the Carbine Accuracy skill mod increases, the chance to hit an enemy with a carbine ranged attack also increases.
carbine_aim, The Carbine Aiming skill modifier directly amplifies the effectiveness of the Aim command. A high skill in this can drastically increase your odds of Aiming, particularly if multiple Aims are used consecutively in the course of one attack.
carbine_hit_while_moving, This mod improves your chace of hitting while moving with a carbine.
carbine_speed, This mod improves your attack speed with carbines.
center_of_being_duration_onehandmelee, This skill mod controls the duration o fthe center of being command when fighting with a one-handed melee weapon.
center_of_being_duration_polearm, This skill mod controls the duration o fthe center of being command when fighting with a polearm.
center_of_being_duration_twohandmelee, This skill mod controls the duration o fthe center of being command when fighting with a two-handed melee weapon.
center_of_being_duration_unarmed, This skill mod controls the duration of the Center Of Being command when fighting unarmed.
chassis_assembly, This skill mod affects crafting and experimentation of starfighter chassis.
chassis_experimentation, This skill mod affects experimentation of ship chassis.
clothing_assembly, This skill mod increases the chance of succeeding when crafting clothing items.
clothing_customization, This skill mod determines the extent of modification you can perform on clothing items in the crafting process.
clothing_experimentation, This skill mod directly affects how many experimentation points you receive when crafting Combat Medic medicines and medical items.
clothing_repair, This skill mod determines how effective you are at repairing clothing.
combat_equillibrium, This mod increases the chance of automatically recovering from a forced posture change.
combat_haste, This mod impoves your speed for all combat actions.
combat_healing_ability, This skill mod determines the range and sophistication of your combat medical techniques and medicines.  The higher the number, the higher the effectiveness of these techniques and medicines.
combat_medic_effectiveness, This skill mod determines how effective you are at performing Combat Medic techniques.
combat_medicine_assembly, This skill mod increases the chances of succeeding when crafting Combat Medic medicines.
combat_medicine_experimentation, This skill mod directly affects how many experimentation points you receive when crafting Combat Medic medicines and medical items.
counterattack, This mod controls your chance of responding to an aggressive attack with an unblockable counterattack.
cover, The Cover skill mod determines how safe you are from enemy notice and attack while in a covered state.
crafting_repair, This skill mod determines how effective you are at general repair of crafted items.
creature_assembly, This skill mod determines the chance at success when assembling creatures as a Bio-Engineer.
creature_experimentation, This skill mod directly affects how many experimentation points you receive while assembling creatures as a Bio-Engineer.
creature_harvesting, This skill mod is used to determine the quantity of resources harvested from a creature.
creature_hit_bonus, Skilled scouts and rangers have gained the ability to strike creatures more effectively.  This raw to-hit bonus only applies to normal ranged attacks.
creature_knowledge, When a player with creature knowledge examines a creature, they learn additional information about the creature's abilities.  The higher this skill mod, the more information displayed.
defense_reverse, This number represents the highest level of reverse engineering you can accomplish.
dissipation_bleeding, This skill mod reduces the duration of bleeding.
dissipation_disease, This skill mod reduces the duration of disease.
dissipation_fire, This skill mod reduces the duration of fire.
dissipation_poison, This skill mod reduces the duration of poison.
dizzy_defense, This mod improves your chance to avoid being dizzied. 
dna_harvesting, This skill allows a Bio-Engineer to sample higher quality DNA from creatures with less trauma to their system.
dodge, This mod increases your chance to dodge incoming attacks. 
droid_assembly, This skill modifier value affects the Droid Engineer's success rate when it comes to assembling droids and droid-related objects.
droid_complexity, This is an erroneous value.
droid_customization, This skill modifier value affects the Droid Engineer's success rate and capabilities when it comes to colorizing and customizing droids and droid-related objects.
droid_experimentation, This skill mod directly affects how many experimentation points you receive when creating droids.
droid_find_chance, This skill modifier value affects the Bounty Hunter player's success rate when it comes to utilizing a Bounty Hunter's droid 'find' feature.
droid_find_speed, This skill modifier value affects the Bounty Hunter player's speed when it comes to utilizing a Bounty Hunter's droid 'find' feature.
droid_track_chance, This skill modifier value affects the Bounty Hunter player's success rate when it comes to utilizing a Bounty Hunter's droid 'track' feature.
droid_track_speed, This skill modifier value affects the Bounty Hunter player's speed when it comes to utilizing a Bounty Hunter's droid 'track' feature.
droid_tracks, This skill modifier value affects the Bounty Hunter player's number of possible 'tracks' when it comes to utilizing a Bounty Hunter's droid 'find' feature.
engine_assembly, This skill mod affects crafting of starfighter engines.
engine_experimentation, This skill mod affects the experimentation of engine components.
engineering_reverse, This number represents the highest level of reverse engineering you can accomplish.
face, This skill mod determines how adept the Image Designer is at modifying the facial attributes of a character. This is used to change eye color, eye size, nose width, and all other facial options.
feign_death, As this ability improves,  so does the player's chance of successfully performing feign death in combat.
flora_harvester_efficiency, This skill mod determines how efficiently your flora harvesters operate.
flora_harvester_maintenance, This skill mod affects the maintenance rate of flora harvesters.
flora_harvester_speed, This skill mod determines how fast your flora harvesters are at general extraction.
food_assembly, This skill mod determines the chance of succeeding when crafting food.
food_experimentation, This skill mod directly affects how many experimentation points you receive when crafting food.
foraging, The foraging skill mod improves the quality of the /forage command.  As this skill mod increases, the chance of successfully foraging improves.
force_absorb, This mod indicates the amount of Force power you will absorb when attacked.
force_armor, This mod increase the amount of normal damage your Force Armor blocks.
force_assembly, This skill mod enhances your ability to succeed when crafting any object.
force_choke, This mod represents the duration of your Force Chokes.
force_control_dark, This skill mod increases the strength of Force Armor, Force Shield and Force Absorb.
force_control_light, This skill mod increases the strength of Force Armor, Force Shield and Force Absorb.
force_defense, This skill mod affects your ability to defend yourself from Force attacks.
force_experimentation, This skill mod directly increases your chance at receiving an amazing success when crafting any object.
force_failure_reduction, This skill mod decreases the chances of failing when crafting an item.
force_feedback, This mod indicates the amount of feedback that a Force attack will cause.
force_luck, You seem to be lucky, and this skill mod is an indication of just how lucky.  This will affect things like the amount of money you find on defeated foes.
force_manipulation_dark, This skill mod increases the efficiency of any Force ability.
force_manipulation_light, This skill mod increases the efficiency of any Force ability.
force_persuade, This skill mod allows you to use a minor Jedi mind trick, getting you better prices for some goods, like skill training from skill trainers.
force_power_dark, This skill mod increases the strength of any offensive Force attack.
force_power_light, This skill mod increases the strength of any offensive Force attack.
force_repair_bonus, This skill mod directly affects your chances of repairing a damaged or broken item.
force_run, The Force run skill mod is a direct multiplier to the movement speed of the Jedi.
force_shield, This mod increase the amount of Force damage your Force Shield blocks.
force_vehicle_control, This skill mod gives you better control over a vehicle that you are piloting, giving it a better maximum turn rate and better turning abilities overall.
force_vehicle_speed, This skill mod affects your acceleration and deceleration abilities with a vehicle that you are piloting, allowing you to achieve your maximum speed more quickly, and making your ability to stop more effective.
forceintimidate_accuracy, This skill mod improves your chance to intimidate enemies with the Force.
forceknockdown_accuracy, This skill mod improves your chance to knock down enemies with the Force.
forcelightning_accuracy, This skill mod improves your chance to successfully hit your enemies with Force lightning.
forcethrow_accuracy, This skill mod improves your chance to hit enemies with small objects thrown with the Force.
forceweaken_accuracy, This skill mod improves your chance to successfully debilitate your enemies with the Force.
frs_dark_envy, Envy modifies Jedi special attacks so that they damage Force power and return some of it to the wielder.
frs_dark_suffering, Suffering modifies Jedi special attacks so that they weaken the attributes of a non-Jedi (or Jedi depleted of Force power) for a short period of time.
frs_dark_vengeance, Vengeance inflicts wounds upon those who attack the Jedi.
frs_light_serenity, Serenity temporarily weakens the attributes of those who attack the Jedi.
frs_light_vigilance, Vigilance modifies Jedi special attacks so that they damage Force power.
frs_light_wisdom, Wisdom modifies Jedi special attacks so that they drain the attribute pools of a non-Jedi (or Jedi depleted of Force power) and transfer them to the wielder.
general_assembly, This skill mod increases the chance of succeeding when crafting general items.
general_experimentation, This skill mod directly affects how many experimentation points you receive when crafting general items.
grenade_assembly, the Grenade Assembly skill mod helps to determine success in grenade assembly.
grenade_experimentation, The Grenade Experimentation skill mod directly affects how many Experimentation points you receive when crafting grenades.
group_burst_run, The group burst run efficiency skill mod is a direct percentage decrease to the cost of using the /burstrun command for all members of your group.
group_melee_defense, The group melee defense skill mod grants everyone in the Squad Leader's party the ability to defend against melee attacks more effectively.
group_ranged_defense, The group ranged defense skill mod grants everyone in the Squad Leader's party the ability to defend against ranged attacks more effectively.
group_slope_move, This skill mod determines how fast members of a Squad Leader's group can move through sloped terrain conditions.  The higher the number, the easier group members can move over hills.
hair, This skill mod determines how adept the Image Designer is at modifying a character's hairstyle. This is used to trim or color facial hair, as well as to sculpt hairstyles and modify hair color.
healing_ability, This skill mod determines the cost to your mind when attempting to heal patients.  The higher the number, the smaller the cost is.
healing_dance_ability, This skill mod determines the number of dances that you know.  The higher the number, the more dances you are likely to know.
healing_dance_mind, This skill mod determines how effective you are at healing the Mind injuries of players that are watching you dance.
healing_dance_shock, This skill mod determines how effective you are at healing the Battle Fatigue of players that are watching you dance.
healing_dance_wound, This skill mod determines how effective you are at healing the Mind/Focus/Willpower wounds of players that are watching you dance.
healing_injury_speed, This skill mod helps to lower the duration between healing injuries.  A higher number means that you can heal injuries more often.
healing_injury_treatment, This skill mod provides a direct bonus to the number of injuries you can heal at once.  A bonus of 50 would equal 50% more injury points healed per treatment.  This also changes the effects of enhancement medication.
healing_music_ability, This skill mod determines what songs you can play and what instruments you can use.  The higher the number, the wider the variety of both songs and instruments.
healing_music_mind, This skill mod determines how effective you are at healing the Mind injuries of players that are listening to you play music.
healing_music_shock, This skill mod determines how effective you are at healing the Battle Fatigue of players that are listening to you play music.
healing_music_wound, This skill mod determines how effective you are at healing the Mind/Focus/Willpower wounds of players that are listening to you play music.
healing_range, This Combat Medic skill mod is used to help extend the range of effective ranged healing.  The higher the number, the further your healing target can be from you and still be healed.
healing_range_speed, This skill mod helps to lower the duration time between ranged healings.  A higher number means that you can perform ranged heals more often.
healing_wound_speed, This skill mod helps to lower the duration time between healing wounds.  A higher number means that you can heal wounds more often.
healing_wound_treatment, This skill mod provides a direct bonus to the amount of wounds you can heal at once.  A bonus of 50 would equal 50% more wounds healed per treatment.  This also changes the effects of enhancement medication.
heavy_acid_beam_accuracy, This mod improves your accuracy with Heavy Acid Beam weapons.
heavy_acid_beam_speed, This mod improves your attack speed with Heavy Acid Beam weapons.
heavy_acid_rifle_accuracy, As the Heavy Acid Rifle skill mod increases, the chance to hit an enemy with a Heavy Acid Rifle increases.
heavy_acid_rifle_speed, This mod improves your attack speed with Heavy Acid Rifles.
heavy_flame_thrower_accuracy, As the Flamethrower Accuracy skill mod increases, the chance to hit an enemy with a Flamethrower increases.
heavy_flame_thrower_speed, This mod improves your attack speed with Flamethrowers.
heavy_lighting_rifle_accuracy, As the Light Lightning Cannon Accuracy skill mod increases, the chance to hit an enemy with a Light Lightning Cannon weapon also increases.
heavy_lightning_beam_accuracy, As the Heavy Lightning Beam Accuracy skill mod increases, the chance to hit an enemy with a Lightning Beam weapon increases.
heavy_lightning_beam_speed, This mod improves your attack speed with Heavy Lightning Beam weapons.
heavy_lightning_rifle_accuracy, As the Light Lightning Cannon Accuracy skill mod increases, the chance to hit an enemy with a Light Lightning Cannon weapon also increases.
heavy_particle_beam_accuracy, As the Heavy Particle Beam Accuracy skill mod increases, the chance to hit an enemy with a Heavy Particle Beam weapon also increases.
heavy_particle_beam_speed, This mod improves your attack speed with Heavy Particle Beam weapons.
heavy_rifle_acid_accuracy, As the Heavy Acid Rifle skill mod increases, the chance to hit an enemy with a Heavy Acid Rifle increases.
heavy_rifle_acid_speed, This mod improves your attack speed with Heavy Acid Rifles.
heavy_rifle_lighting_accuracy, As the Light Lightning Cannon Accuracy skill mod increases, the chance to hit an enemy with a Light Lightning Cannon weapon also increases.
heavy_rifle_lightning_accuracy, As the Light Lightning Cannon Accuracy skill mod increases, the chance to hit an enemy with a Light Lightning Cannon weapon also increases.
heavy_rifle_lightning_speed, This mod improves your attack speed with Light Lightning Cannons.
heavy_rocket_launcher_accuracy, As the Heavy Rocket Launcher skill mod increases, the chance to hit an enemy with a Heavy Rocket Launcher also increases.
heavy_rocket_launcher_speed, This mod improves your attack speed with Heavy Rocket Launchers.
heavyweapon_accuracy, The Heavy Weapon Accuracy skill mod changes how often you tend to hit with heavy weapons.
heavyweapon_speed, The Heavy Weapon Speed skill mod changes how often you can fire your weapon.
hiring, As your hiring skill mod increases, the variety of vendors you can place improves.  A high hiring skill mod gives the player access to new types of terminal, droid, and NPC vendors.
instrument_assembly, This skill mod increases the chances of succeeding when crafting instruments.
intimidate, This mod increases the chance of terrifying your target and putting them into the intimidated state. 
intimidate_defense, This mod decreases the chance of becoming intimidated. 
jedi_force_power_max, This mod represents the total Force power that is able to be wielded.
jedi_force_power_regen, This mod represents the rate at which your Force power regenerates in points per 10 seconds.
jedi_saber_assembly, This mod determines your chance of successfully assembling a lightsaber.
jedi_saber_experimentation, This mod directly affects the extent to which you are able to customize and experiment when crafting a lightsaber.
jedi_state_defense, This skill mod increases a Jedi's natural resistance to all states
jedi_toughness, This skill mod increases a Jedi's natural resistance to all damage types except lightsaber
keep_creature, This skill mod represents how many active pets you can have under your control at one time.
knockdown_defense, This mod will protect you from being knocked down.
language_all_comprehend, With this ability a character can understand most languages spoken in the known galaxy.  (The player can understand any spoken language without special skills.)
language_basic_comprehend, This skill mod determines how well you can comprehend Basic as spoken by other players.
language_basic_comprehension, This skill mod determines how well you can comprehend Basic as spoken by other players.
language_basic_speak, This skill mod determines how well you can speak Basic to other players.
language_bothan_comprehend, This skill mod determines how well you can comprehend Bothese as spoken by other players.
language_bothan_comprehension, This skill mod determines how well you can comprehend Bothese as spoken by other players.
language_bothan_speak, This skill mod determines how well you can speak Bothese to other players.
language_ithorian_comprehend, This skill mod determines how well you can comprehend Ithorian as spoken by other players.
language_ithorian_comprehension, This skill mod determines how well you can comprehend Ithorian as spoken by other players.
language_ithorian_speak, This skill mod determines how well you can speak Ithorian to other players.
language_lekku_comprehend, This skill mod determines how well you can comprehend the language of Lekku as displayed by Twi'leks.
language_lekku_comprehension, This skill mod determines how well you can comprehend the language of Lekku as displayed by Twi'leks.
language_lekku_speak, This skill mod determines how well you can communicate in Lekku to other players.
language_moncalamari_comprehend, This skill mod determines how well you can comprehend Mon Calamari as spoken by other players.
language_moncalamari_comprehension, This skill mod determines how well you can comprehend Mon Calamarian as spoken by other players.
language_moncalamari_speak, This skill mod determines how well you can speak Mon Calamarian to other players.
language_rodian_comprehend, This skill mod determines how well you can comprehend Rodese as spoken by other players.
language_rodian_comprehension, This skill mod determines how well you can comprehend Rodese as spoken by other players.
language_rodian_speak, This skill mod determines how well you can speak Rodese to other players.
language_sullustan_comprehend, This skill mod determines how well you can comprehend Sullustan as spoken by other players.
language_sullustan_comprehension, This skill mod determines how well you can comprehend Sullustan as spoken by other players.
language_sullustan_speak, This skill mod determines how well you can speak Sullustan to other players.
language_trandoshan_comprehend, This skill mod determines how well you can comprehend Dosh as spoken by other players.
language_trandoshan_comprehension, This skill mod determines how well you can comprehend Dosh as spoken by other players.
language_trandoshan_speak, This skill mod determines how well you can speak Dosh to other players.
language_twilek_comprehend, This skill mod determines how well you can comprehend Ryl as spoken by other players.
language_twilek_comprehension, This skill mod determines how well you can comprehend Ryl as spoken by other players.
language_twilek_speak, This skill mod determines how well you can speak Ryl to other players.
language_wookiee_comprehend, This skill mod determines how well you can comprehend Shyriiwook as spoken by Wookiees.
language_wookiee_comprehension, This skill mod determines how well you can comprehend Shyriiwook as spoken by Wookiees.
language_wookiee_speak, This skill mod determines how well you can speak Shyriiwook to other players.
language_zabrak_comprehend, This skill mod determines how well you can comprehend Zabrak as spoken by other players.
language_zabrak_comprehension, This skill mod determines how well you can comprehend Zabrak as spoken by other players.
language_zabrak_speak, This skill mod determines how well you can speak Zabrak to other players.
leadership, This skill mod affects different Squad Leader abilities.
light_lightning_cannon_accuracy, As the Light Lightning Cannon Accuracy skill mod increases, the chance to hit an enemy with a Light Lightning Cannon weapon also increases.
light_lightning_cannon_speed, This mod improves your attack speed with Light Lightning Cannons.
lightsaber_toughness, This skill mod decreases the amount of melee damage taken when wielding a lightsaber.
manage_vendor, For each point of Manage Vendor, the player may place a vendor in a structure.
markings, This skill mod determines how adept the Image Designer is at modifying the body markings of a character. This is used to change such things as  tattoos, Lekku markings, and Mon Calamarian spot patterns.
mask_scent, The higher your mask scent skill mod, the more effective you will be at hiding from aggressive and stalking creatures while /maskscent is enabled.  As this skill mod increases, the delay until you can use /maskscent again when detected is reduced and the duration of your scent mask increases.
medical_foraging, This skill mod determines how easy it is for you to successfully Medical Forage.
medicine_assembly, This skill mod increases the chance of succeeding when crafting medicine and medical items.
