name, value
medicine_experimentation, This skill mod directly affects how many experimentation points you receive when crafting medicine and medical items.
meditate, As this skill modifier increases, the effects of the /meditate command become more potent.
melee_accuracy, This skill mod will improve your accuracy with all melee weapons.
melee_defense, This mod improves your defense against melee attacks.
melee_speed, This skill mod will improve your speed with all melee weapons.
mindblast_accuracy, This skill mod improves your chance to successfully invade and cause discord in the mind of an enemy.
missile_launching, This skill mod aids in controlling how well a missile shot is set up, how well the missile is locked onto its target, and other factors affecting a successful missile attack.
morale_management, This skill mod affects the morale of a Squad Leader's group.
mountedcreature, Current carrying a rider.
offensive_strategy, This skill mod affects the efficiency of various tactics.
onehandlightsaber_accuracy, This skill mod improves your accuracy with one-handed lightsabers.
onehandlightsaber_speed, This skill mod improves your attack speed with one-handed lightsabers.
onehandlightsaber_toughness, This skill mod decreases the amount of damage taken while wielding one-handed lightsabers.
onehandmelee_accuracy, This mod will improve your accuracy with one-handed melee weapons.
onehandmelee_center_of_being_efficacy, This skill mod controls the efficacy of Center Of Being when wielding a one-handed melee weapon.
onehandmelee_damage, This mod will increase your damage with one-handed melee weapons.
onehandmelee_speed, This mod will improve your speed with one-handed melee weapons.
onehandmelee_toughness, This mod will decrease the melee damage taken by you while using a one-handed melee weapon. 
onehandmeleeaccuracy, This mod will improve your accuracy with one-handed melee weapons.
pilot_special_tactics, This skill mod reflects the pilot's level of general knowledge and increasing ability in executing the various pilot command tricks of the trade that they learn.
pistol_accuracy, As the Pistol Accuracy skill mod increases, the chance to hit an enemy with a pistol ranged attack also increases.
pistol_accuracy_while_standing, This improves your pistol accuracy while standing.
pistol_aim, The Pistol Aiming skill modifier directly amplifies the effectiveness of the Aim command. A high skill in this can drastically increase your odds of Aiming, particularly if multiple Aims are used consecutively in the course of one attack.
pistol_hit_while_moving, This improves your ability to hit while moving and using a pistol.
pistol_speed, This mod improves your attack speed with pistols.
polearm_accuracy, This improves your accuracy with polearms.
polearm_center_of_being_efficacy, This skill mod controls the efficacy of Center Of Being when wielding a polearm.
polearm_speed, This mod improves your speed with polearms.
polearm_toughness, This mod decreases the melee damage you will take when wielding a polearm.
polearmlightsaber_accuracy, This skill mod improves your accuracy with double-bladed lightsabers.
polearmlightsaber_speed, This skill mod improves your attack speed with double-bladed lightsabers.
polearmlightsaber_toughness, This skill mod decreases the amound of damage taken while wielding double-bladed lightsabers.
posture_change_down_defense, This mod will protect you from posture changing attacks.
posture_change_up_defense, This mod will protect you from posture changing attacks.
power_systems, This skill mod affects the crafting of reactors and power systems for starfighters.
power_systems_experimentation, This skill mod affects the experimentation of ship power systems.
propulsion_reverse, This number represents the highest level of reverse engineering you can accomplish.
ranged_accuracy, This skill mod will improve your accuracy with all ranged weapons.
ranged_defense, This mod will make you harder to hit with ranged weapons.
ranged_speed, This skill mod will improve your speed with all ranged weapons.
rescue, This modifier will increase your chance of successfully using the Ranger profession's rescue command.
resistance_bleeding, This skill mod increases the chance to resist bleeding.
resistance_disease, This skill mod increases the chance to resist the effects of disease.
resistance_fire, This skill mod increases the chance to resist fire.
resistance_poison, This skill mod increases the chance to resist poison.
resistance_states, This skill mod increases the chance to resist the effects of state attacks.
reverse_engineering, This skill mod affects analysis and construction of reverse engineered spaceship parts.
ridingmount, Currently riding on a vehicle or creature.
rifle_accuracy, As the Rifle Accuracy skill mod increases, the chance to hit an enemy with a rifle ranged attack also increases.
rifle_aim, The Rifle Aiming skill modifier directly amplifies the effectiveness of the Aim command. A high skill in this can drastically increase your odds of Aiming, particularly if multiple Aims are used consecutively in the course of one attack.
rifle_concealment_chance, This mod allows you to attack a mobile without attracting the attention from other mobiles nearby. You must be far enough away from the mobile for this ability to work properly.
rifle_crawl, The Rifle Crawl Speed skill modifier influences how fast players can crawl while using a rifle.
rifle_hit_while_moving, This mod will make you more accurate with a rifle while moving.
rifle_speed, This mod will increase your attack speed with a rifle.
saber_block, This skill mod determines your chance to block ranged attacks with your lightsaber.
sales, This skill mod determines how effective a vendor is at sales.
shields_assembly, This skill mod affects the crafting of starfighter deflector shields.
shields_experimentation, This skill mod affects the experimentation of ship shield systems.
shop_sign, This skill mod governs which shop signs are accessible to merchants.
slope_move, Terrain negotiation affects the player's ability to move in rough terrain.  From 0 to 50, this skill increases the player's ability to move up slopes quickly.  From 50 to 100, this skill increases the player's ability to move fast while prone.
spice_assembly, This skill mod governs the effectiveness of spice crafting.
spice_experimentation, This skill mod controls the quality of results in a spice experimentation session.
steadyaim, This skill mod determines the effectiveness of a Squad Leader's /steadyaim command.
stored_pets, This is the number of pets you may have stored at any time.
structure_assembly, This skill mod determines the chance of succeeding when crafting structures.
structure_complexity, This skill mod determines the level of complexity you have at your disposal when creating structures.
structure_experimentation, This skill mod directly affects how many experimentation points you receive when creating structures.
stun_defense, This mod will decrease your chance of being stunned.
survey_flora_structural, A higher Flora Surveying skill allows players to obtain samples more efficiently. Resources will start to become extractable at lower percentages, and more resources may be found on a successful sample.  However, this skill mod does not necessarily increase the chances of getting a successful sample. Prospecting has always been something of a hit-or-miss vocation.
survey_flora_structural_range, The Flora Surveying Range skill determines the range at which surveying is possible. A high Flora Surveying Range skill means that one can either modify the range at which surveying is seen. The result is that it is possible to get more accurate readings by reducing the surveying range one is looking at. This requires a surveying tool that supports range modification.
survey_flora_structural_resolution, A higher Flora Surveying Resolution tool gives prospecting players the ability to increase the number of resource marks seen on their survey screen. The result is that players with a higher skill in this will be much more efficient at expediently tracking down high resource deposits, as compared to a novice Artisan.
survey_gas, A higher Gas Surveying skill allows players to obtain samples more efficiently. Resources will start to become extractable at lower percentages, and more resources may be found on a successful sample.  However, this skill mod does not necessarily increase the chances of getting a successful sample. Prospecting has always been something of a hit-or-miss vocation.
survey_gas_range, The Gas Surveying Range skill determines the range at which surveying is possible. A high Gas Surveying Range skill means that one can either modify the range at which surveying is seen. The result is that it is possible to get more accurate readings by reducing the surveying range one is looking at. This requires a surveying tool that supports range modification.
survey_gas_resolution, A higher Gas Surveying Resolution tool gives prospecting players the ability to increase the number of resource marks seen on their survey screen. The result is that players with a higher skill in this will be much more efficient at expediently tracking down high resource deposits, as compared to a novice Artisan.
survey_liquid, A higher Liquid Surveying skill allows players to obtain samples more efficiently. Resources will start to become extractable at lower percentages, and more resources may be found on a successful sample.  However, this skill mod does not necessarily increase the chances of getting a successful sample. Prospecting has always been something of a hit-or-miss vocation.
survey_liquid_range, The Liquid Surveying Range skill determines the range at which surveying is possible. A high Liquid Surveying Range skill means that one can either modify the range at which surveying is seen. The result is that it is possible to get more accurate readings by reducing the surveying range one is looking at. This requires a surveying tool that supports range modification.
survey_liquid_resolution, A higher Liquid Surveying Resolution tool gives prospecting players the ability to increase the number of resource marks seen on their survey screen. The result is that players with a higher skill in this will be much more efficient at expediently tracking down high resource deposits, as compared to a novice Artisan.
survey_solid, A higher Mineral Surveying skill allows players to obtain samples more efficiently. Resources will start to become extractable at lower percentages, and more resources may be found on a successful sample.  However, this skill mod does not necessarily increase the chances of getting a successful sample. Prospecting has always been something of a hit-or-miss vocation.
survey_solid_range, The Mineral Surveying Range skill determines the range at which surveying is possible. A high Mineral Surveying Range skill means that one can either modify the range at which surveying is seen. The result is that it is possible to get more accurate readings by reducing the surveying range one is looking at. This requires a surveying tool that supports range modification.
survey_solid_resolution, A higher Mineral Surveying Resolution tool gives prospecting players the ability to increase the number of resource marks seen on their survey screen. The result is that players with a higher skill in this will be much more efficient at expediently tracking down high resource deposits, as compared to a novice Artisan.
surveying, As your surveying skill increases, you gain the ability to scan for resources over a greater distance.  You also gain a higher chance of successfully harvesting resources and yet a higher yield per successful sample attempt.
systems_reverse, This number represents the highest level of reverse engineering you can accomplish.
take_cover, This modifier will increase your chance of succesfully taking cover in ranged combat.
tame_aggro, This skill represents the Creature Handler's ability to tame aggressive creature types.
tame_bonus, This skill mod assists in the taming of wild creatures.
tame_level, This skill mod increases the maximum level of pet that that you can tame, and the maximum number of pet levels you may have active at any one time.  For example, a total of 20 means that you can tame creatures that are of up to level 20.  You could call a level 20 creature, or two level 10 creatures.  Note that you must also have sufficient 'Additional Pets' skill to call multiple pets regardless of level.
tame_non_aggro, This skill represents the Creature Handler's ability to tame non-aggressive creature types.
taunt, This modifier will increase your chance of succesfully taunting a creature as a Brawler.
thrown_accuracy, The Thrown Weapon Accuracy skill mod changes how often you tend to hit with thrown weapons.
thrown_speed, This mod improves your speed with thrown weapons.
tissue_assembly, This skill mod determines the chance of succeeding when assembling tissue as a Bio-Engineer.
tissue_experimentation, This skill mod directly affects how many experimentation points you receive when assembling tissue as a Bio-Engineer.
trapping, The trapping skill mod represents a Ranger or Scout's ability to use traps effectively.  As this skill mod increases, the player gains the ability to use more complex traps.  The player also becomes better at hitting increasingly stronger creatures with traps.
twohandlightsaber_accuracy, This skill mod improves your accuracy with two-handed lightsabers.
twohandlightsaber_speed, This skill mod improves your attack speed with two-handed lightsabers.
twohandlightsaber_toughness, This skill mod decreases the amount of damage taken while wielding two-handed lightsabers.
twohandmelee_accuracy, This mod improves your accuracy with two-handed melee weapons.
twohandmelee_center_of_being_efficacy, This skill mod controls the efficacy of Center Of Being when wielding a two-handed melee weapon.
twohandmelee_speed, This mod improves your speed with two-handed melee weapons.
twohandmelee_toughness, This mod decreases the amount of melee damage you will take when using a two-handed melee weapon.
unarmed_accuracy, This mod improves your accuracy when fighting unarmed.
unarmed_center_of_being_efficacy, This skill mod controls the efficacy of Center Of Being when fighting unarmed.
unarmed_damage, This mod improves your damage when fighting unarmed.
unarmed_passive_defense, This modifier improves your chances of reacting to a succesful hit with a dodge, counterattack or block.
unarmed_speed, This mod improves your speed when fighting unarmed.
unarmed_toughness, This mod will decrease the amount of melee damage you take when fighting unarmed.
vendor_item_limit, This skill mod determines how many items a merchant may sell on each vendor. 
volley, This mod improves your chance of successfully launching volley fire.
warcry, This modifier increases the chance of succesfully executing the Brawler profession's warcry command.
weapon_assembly, This skill mod determines the chance of succeeding when crafting weapons.
weapon_experimentation, This skill mod directly affects how many experimentation points you receive when creating weapons.
weapon_repair, This skill mod determines how effective you are at repairing weapons.
weapon_systems, This skill mod affects crafting of starfighter weapon systems.
weapon_systems_experimentation, This skill mod affects the experimentation of ship weapon systems.
bountyhunter_toughness, This skill mod increases a Bounty Hunter's natural resistance to lightsaber damage.
force_enhancement_dark, This skill mod increases your ability to Force Drain and Force Channel.
force_enhancement_light, This skill mod increases your ability to Force Drain and Force Channel.
force_healing_dark, This skill mod increases your Force healing abilities.
force_healing_light, This skill mod increases your Force healing abilities.
pharmacy, This skill mod determines the level of medication that you have access to use to enhance patients with. The higher the number, the more advanced your enhancement selection is.
saber_skill, This skill mod increases your damage dealt from lightsaber abilities.
pet_toughness, This skill mod increases the toughness of your pets, decreasing the amount of damage they take.
